city,stationId,station_source,name,address,lat,lng,sea_level,status
Almaty,s2,IQAir,,Yegizbaev - Rozybakiev,43.230287,76.886544,841.0,ok
Almaty,s3,IQAir,,Bogenbay Batyr - Masanchi,43.252323,76.931237,804.0,ok
Almaty,60ec15223fdcd35938ff8d9a,Clarity,CHP,"Морг (Городское патологоанатомическое бюро), 131, улица Аксайская, Alatau District, Almaty, 050033, Kazakhstan",43.29161420999885,76.8043675626686,0.0,ok
Almaty,60ec15223fdcd35938ff8d04,Clarity,KBTU,"Panfilov Street, Almaly District, Almaty, 050004, Kazakhstan",43.25347876621724,76.94536842109201,0.0,ok
Almaty,609935dcc9348052e0c5d929,Clarity,DIS-7,"Интернациональная улица, Nauryzbay District, Almaty, Karasay District, Almaty Region, 040203, Kazakhstan",43.205327130825815,76.7769168478819,0.0,ok
Almaty,609935dec9348052e0c5da7f,Clarity,Alatau,"Алатау, Кафе, 53, улица Казыбек Тауасарулы, Bostandyk District, Almaty, 050023, Kazakhstan",43.17657810428695,76.89770583884862,0.0,ok
Almaty,60ec15223fdcd35938ff8d9e,Clarity,EkoPost,"Rysqulov avenue, Aqbulaq, Alatau District, Almaty, 050038, Kazakhstan",43.24965850474111,76.80559998147626,0.0,ok
Almaty,60ec15223fdcd35938ff8cf0,Clarity,AsiaFood,"Alatau District, Almaty, 050038, Kazakhstan",43.242831865620715,76.82871773078021,0.0,ok
Almaty,60ec151f3fdcd35938ff8aae,Clarity,Ippodrom,"Микрорайон Кулагер, Jetysu District, Almaty, 050064, Kazakhstan",43.30777990786845,76.92324250852016,0.0,ok
Almaty,609935dec9348052e0c5db1d,Clarity,Atyrau 54,"Атырау микрорайон, Medeu District, Almaty, 050019, Kazakhstan",43.29677960017615,76.99158959609677,0.0,ok
Almaty,60ec15213fdcd35938ff8c60,Clarity,School 77,"улица Закарпатская, Альмерек, Жулдыз, Turksib District, Almaty, 050049, Kazakhstan",43.36341047552753,77.00457206998595,0.0,ok
Almaty,60ec15233fdcd35938ff8de8,Clarity,169 School,"№169, Школа, 109, Утемисова улица, Шанырак 1, Шанырак, Alatau District, Almaty, 050065, Kazakhstan",43.29713287788326,76.86110376445615,0.0,ok
Almaty,609935dec9348052e0c5dadd,Clarity,Hospital-7,"KazMunayGas, Райымбек даңғылы, Kalkaman-1, Qalqaman, Nauryzbay District, Almaty, A10H6G1, Kazakhstan",43.23396107591564,76.80012719631037,0.0,ok
Almaty,60ec15203fdcd35938ff8bfa,Clarity,Magnum-273,"Magnum Сash & Сarry, 273, улица Хан Шатыр, Aqbulaq, Alatau District, Almaty, 050038, Kazakhstan",43.25074042971093,76.82301292953343,0.0,ok
Almaty,60ec15213fdcd35938ff8c66,Clarity,School 137,"№137, Школа, 65А, Макатаева (Айнабулак), Айнабулак 2, Айнабулак, Jetysu District, Almaty, 050014, Kazakhstan",43.31676494629688,76.91083701308452,0.0,ok
Almaty,60ec151f3fdcd35938ff8aa0,Clarity,School 160,"улица Заводская (Карасу), Карасу, Alatau District, Almaty, 050014, Kazakhstan",43.33583610930727,76.91287406657065,0.0,ok
Almaty,60ec15233fdcd35938ff8dde,Clarity,School 175,"№175, Гимназия Жана Гасыр, 21, улица Саяна Шаймерденова, Auezov District, Almaty, 050052, Kazakhstan",43.19957298448716,76.85428363117833,0.0,ok
Almaty,60ec15223fdcd35938ff8da6,Clarity,School 186,"Айманова (Акжар), Akzhar, Nauryzbay District, Almaty, 040203, Kazakhstan",43.19147922175904,76.80283567546142,0.0,ok
Almaty,609935ddc9348052e0c5da5f,Clarity,School 187,"улица Жандосова (Таусамалы), Каменка, Nauryzbay District, Almaty, 050006, Kazakhstan",43.185794307121434,76.82847702612057,0.0,ok
Almaty,60ec15223fdcd35938ff8ce8,Clarity,School 190,"Bostandyk District, Almaty, A17B7C3, Kazakhstan",43.15475667376976,76.89920068011331,0.0,ok
Almaty,60ec15213fdcd35938ff8c4e,Clarity,School 192,"Какишева улица, Курамыс, Каргайлы, Nauryzbay District, Almaty, 050070, Kazakhstan",43.172031,76.852339,0.0,ok
Almaty,609935ddc9348052e0c5da73,Clarity,Zhetysu 47,"Малая станица, Medeu District, Almaty, 050019, Kazakhstan",43.29170729096677,76.98979982475333,0.0,ok
Almaty,60ec15213fdcd35938ff8c08,Clarity,Halyk Arena,"Halyk Arena, 2, Кульжинский тракт, Малая станица, Medeu District, Almaty, 050019, Kazakhstan",43.2872873869579,76.99066870946444,0.0,ok
Almaty,60ec15223fdcd35938ff8d7c,Clarity,Ritz Palace,"EcoDoner, Dostyk Avenue, Алматы Тауэр, Medeu District, Almaty, 050051, Kazakhstan",43.228328836957445,76.9602836930437,0.0,ok
Almaty,60ec15203fdcd35938ff8bc4,Clarity,Suiynbay-55,"13-й Военный городок улица, Turksib District, Almaty, 050049, Kazakhstan",43.37664309140991,76.99055491708968,0.0,ok
Almaty,60ec15203fdcd35938ff8bfe,Clarity,Almaty Arena,"Almaty Arena, 1, Нуркент микрорайон, Нұркент, Aqbulaq, Alatau District, Almaty, 050033, Kazakhstan",43.26407854761793,76.81687957488205,0.0,ok
Almaty,60ec15213fdcd35938ff8cae,Clarity,Gymnasium 39,"улица Спортивная, Трудовик, Alatau District, Almaty, 040707, Kazakhstan",43.3481851029586,76.843300856246,0.0,ok
Almaty,60ec151f3fdcd35938ff8b1c,Clarity,Kokzhiyek-63,"№177, Школа, Кокжиек микрорайон, Jetysu District, Almaty, 050028, Kazakhstan",43.356932273722045,76.92256698847065,0.0,ok
Almaty,60ec15213fdcd35938ff8c5c,Clarity,Nurly street,"улица Алатау, Елисейские поля, Шугыла микрорайон, Nauryzbay District, Almaty, A10H6G1, Kazakhstan",43.22880425521485,76.7774914696639,0.0,ok
Almaty,60ec15213fdcd35938ff8c6a,Clarity,Respublika 4,"Almaty City Akimat, 4, Timirjazev Street, Bostandyk District, Almaty, 050013, Kazakhstan",43.23680399999999,76.944814,0.0,ok
Almaty,60ec15213fdcd35938ff8cc6,Clarity,Ryskulova 81,"улица Галилея, Рабочий посёлок, Jetysu District, Almaty, 050034, Kazakhstan",43.27865455271868,76.90347457672105,0.0,ok
Almaty,60ec151f3fdcd35938ff8aa8,Clarity,Detsad School,"Дархан микрорайон, Дархан, Ужет, Alatau District, Almaty, 050024, Kazakhstan",43.31276134876108,76.87604335791103,0.0,ok
Almaty,60ec15223fdcd35938ff8da8,Clarity,Iliyski trakt,"Беринга улица, Алтай, Turksib District, Almaty, 050039, Kazakhstan",43.34158170973398,76.98192511971963,0.0,ok
Almaty,609935ddc9348052e0c5da61,Clarity,Satpayeva 40B,"Международная школа Алматы, Zhandosov Street, Коктем, Bostandyk District, Almaty, 050057, Kazakhstan",43.234052077650695,76.90325460003285,0.0,ok
Almaty,60ec15223fdcd35938ff8cec,Clarity,Shamiyeva St.,"улица Шамиевой, Jetysu District, Almaty, 050016, Kazakhstan",43.283229322033016,76.92753219053206,0.0,ok
Almaty,60ec15213fdcd35938ff8cce,Clarity,Elaman 105 St.,"Еламан улица, Jetysu District, Almaty, 050028, Kazakhstan",43.368606872490815,76.94705072701963,0.0,ok
Almaty,60ec15223fdcd35938ff8cfc,Clarity,Kokkainar Micro,"Заречная улица, Kokaynar, Alatau District, Almaty, 050065, Kazakhstan",43.290757,76.841229,0.0,ok
Almaty,60ec15233fdcd35938ff8de2,Clarity,Kotelnikova St.,"улица Котельникова, Turksib District, Almaty, 050037, Kazakhstan",43.31039688071044,76.94216898220435,0.0,ok
Almaty,60ec15213fdcd35938ff8cc4,Clarity,Magnum Besagash,"Magnum Сash & Сarry, 167, Талгарский тракт, Medeu District, Almaty, 050019, Kazakhstan",43.29222281590885,77.0121766907784,0.0,ok
Almaty,60ec15213fdcd35938ff8c4a,Clarity,State School 11,"Волгоградская улица, Пятилетка, микрорайон ""Пятилетка"", Turksib District, Almaty, A36H0B8, Kazakhstan",43.34612629685516,76.95925514139849,0.0,ok
Almaty,60ec151f3fdcd35938ff8b18,Clarity,Shkola-Gimnaziya 152,"№152, Школа, 48, Жалайыр улица, Улжан 1, Alatau District, Almaty, 050024, Kazakhstan",43.30173409474242,76.87217086857771,0.0,ok
Almaty,60ec15213fdcd35938ff8c06,Clarity,"Road, Almaty Industrial Zone","улица Индустриальная, Alatau District, Almaty, 050033, Kazakhstan",43.316523,76.804295,0.0,ok
Almaty,60ec15213fdcd35938ff8cac,Clarity,Nicolas International chain of wineries,"Наурыз-2, ЖК, 4/1, Рахмадиева улица, Bostandyk District, Almaty, 050023, Kazakhstan",43.19364967260028,76.90962542469542,0.0,ok
Almaty,38834077,AirKaz.org,Dual1,"Timiryazev Street, Almaty, Бостандыкский район, Almaty, 050040, Kazakhstan",43.23,76.9326,0.0,ok
Almaty,3269728,AirKaz.org,KazGU2,"Gagarin Ave, Каргалинка, Almaty, Бостандыкский район, Almaty, 050060, Kazakhstan",43.206,76.9,0.0,ok
Almaty,30960812,AirKaz.org,КазГУ,"Al-Farabi Kazakh National University, Al-Farabi Avenue (West), Бостандыкский район, Almaty, 050040, Kazakhstan",43.22,76.9264,0.0,ok
Almaty,37917495,AirKaz.org,Есенова,"улица Есенова, Жетысуский район, Almaty, 050056, Kazakhstan",43.293,76.951,0.0,ok
Almaty,39168240,AirKaz.org,Карасу 2,"Карасу, Алатауский район, Almaty, Kazakhstan",43.3388,76.9032,0.0,ok
Almaty,9,AirKaz.org,Ерменсай,"Ерменсай, Бостандыкский район, Almaty, 050023, Kazakhstan",43.174,76.917,0.0,ok
Almaty,36671067,AirKaz.org,Таусамал,"улица 5-я линия (Тау Самал), Тау Самалы, Тастыбулак, Наурызбайский район, Almaty, 050006, Kazakhstan",43.202,76.812,0.0,ok
Almaty,37380840,AirKaz.org,ул.Дулати,"Каргалинка, Нурлытау, Бостандыкский район, Almaty, 050023, Kazakhstan",43.17,76.899,0.0,ok
Almaty,36200067,AirKaz.org,Айнабулак-3,"Макатаева улица, микрорайон Айнабулак-3, Жетысуский район, Almaty, 050014, Kazakhstan",43.324,76.919,0.0,ok
Almaty,39379024,AirKaz.org,Муканова 159,"Весна, ЖК, 159, Mukanov Street, Алмалинский район, Almaty, 050008, Kazakhstan",43.2572,76.914,0.0,ok
Almaty,30369354,AirKaz.org,"Тулебаева, 82","Tolebaev Street, Медеуский район, Almaty, A25Y5H4, Kazakhstan",43.2576,76.9484,0.0,ok
Almaty,34703847,AirKaz.org,ул.Туруспекова,"Турусбекова, Кристал, Наурызбайский район, Almaty, 050070, Kazakhstan",43.178,76.87,0.0,ok
Almaty,2,AirKaz.org,Альфараби - Маркова,"Al-Farabi Avenue (East), Асқартау, Медеуский район, Almaty, 050044, Kazakhstan",43.224,76.938,0.0,ok
Almaty,109,AirKaz.org,Тулебаева-Курмангазы,"Kurmangazy Str, Медеуский район, Almaty, 050021, Kazakhstan",43.245,76.95,0.0,ok
Almaty,27423,Purple Air,Luxor,"улица Оспанова, Турксиб, Medeu District, Almaty, 050020, Kazakhstan",43.204582,76.974144,0.0,ok
Almaty,27173,Purple Air,Novy Mir,"Al-Farabi Avenue (East), Асқартау, Медеуский район, Almaty, 050051, Kazakhstan",43.227127,76.956795,0.0,ok
Almaty,27443,Purple Air,"Block B, Esentai","Esentai Residence II, 77/2, Al-Farabi Avenue (West), Bostandyk District, Almaty, 050060, Kazakhstan",43.22,76.928604,0.0,ok
Almaty,27297,Purple Air,Zholdasbekova 97,"Dostyk Plaza, 111, Zholdasbekov Street, Medeu District, Almaty, 050050, Kazakhstan",43.233925,76.9549,0.0,ok
Almaty,27193,Purple Air,"Kazibek bi 41, Park Palace","Kazybek Bi Street, Медеуский район, Almaty, 05000, Kazakhstan",43.257915,76.957085,0.0,ok
Almaty,43241,Purple Air,Kazakhstan International School,"Al-Farabi Avenue (East), Bostandyk District, Almaty, 050040, Kazakhstan",43.206642,76.922905,0.0,ok
Almaty,k56,KazHydroMet,PCP #1,"Satpaev St, 7",43.237859,76.93394,851.0,ok
Almaty,k25,KazHydroMet,PCP #2,"Aerodromnaya St, 2B",43.356554,76.87545,704.0,ok
Almaty,k58,KazHydroMet,PCP #3,"Nurkent microdistrict, 6/1",43.258748,76.81706,758.0,ok
Almaty,k57,KazHydroMet,PCP #4,"Suyunbay Ave, 505",43.374376,76.992008,659.0,not
Almaty,k60,KazHydroMet,PCP #5,"Halyk Arena, Kuldzhinsky tract, 2D",43.288125,76.990615,743.0,ok
Almaty,k59,KazHydroMet,PCP #6,Gulder Park (Apparatus of Akim of Zhetysu distr.),43.301062,76.925444,720.0,ok
Almaty,k55,KazHydroMet,PCP #27,"Vasily Benberin St, 34",43.271831,76.844818,750.0,ok
Almaty,k97,KazHydroMet,PCP #28,"Akhmetov St, 54",43.360683,77.006407,662.0,ok
Almaty,k26,KazHydroMet,PCP #29,"R.Zorge St, 14",43.338052,76.952083,688.0,ok
Almaty,k28,KazHydroMet,PCP #30,"""Shanyrak-2"" microdistrict, Zhankozha batyr St",43.298778,76.851498,730.0,ok
Almaty,k27,KazHydroMet,PCP #31,Park named after the First President,43.180754,76.888068,1047.0,ok
Almaty,s1,US Consulate,,Abay - Sain,43.22189,76.850993,853.0,ok
Almaty,s8,PurpleAir.com,,Al-Farabi - Mendikulov,43.227126,76.956792,941.0,ok
Almaty,s7,PurpleAir.com,,Dostyk - Ospanov,43.204942,76.975031,1070.0,ok
Almaty,s5,PurpleAir.com,,Al-Farabi - Esentai,43.219596,76.930487,896.0,ok
Almaty,s6,PurpleAir.com,,Nazarbayev - Ramstore,43.230924,76.95039,915.0,ok
Almaty,65242,Citizen Science project luftdaten.info,улица Жамакаева,"улица Жамакаева, микрорайон Горный Гигант, Медеуский район, Almaty, 050044, Kazakhstan",43.21126910743,76.94824486971,0.0,ok
